id,title,price,location,size,size_unit,bedrooms,bathrooms
3626608,شقة 114م للبيع في زينيا مروج -الاسكندرية,"2,359,800",مروج,114,متر²,3,1
4096322,شقق 151 متر² للبيع فى سموحة الجديدة,"1,880,000",كومباوند اليكس ستارت - سموحة الجديده,151,متر²,3,2
4056584,شقة للبيع 124 م سموحة الجديدة  (بجوار نادي الاتحاد الجديد)  / p 63,"2,100,000",بجوار نادي الاتحاد الجديد,124,متر²,3,1
4056588,شقة للبيع 124 م سموحة الجديدة  (بجوار نادي الاتحاد الجديد) p 63,"2,100,000",سموحة الجديدة  (بجوار نادي الاتحاد الجديد),124,متر²,3,1
4053835,شقة للبيع 145 م سموحة الجديدة  (كومباوند سموحة اليجانس  ),"1,750,000",سموحة الجديدة,145,متر²,3,2
3890330,شقة  للبيع 114 م بكمباوند العروبة سكاي لاين بالقسط وتسهيلات فى السداد,"3,933,000",كمباوند العروبة سكاي لاين,114,متر²,2,2
4051852,شقة للبيع 195 م سموحة الجديدة (كمبوند الصفوة),"3,000,000",سموحة الجديدة (كمبوند الصفوة),195,متر²,4,2
4043732,شقة للبيع 120 م سموحة الجديده (على الطريق الزراعى),"2,150,000",على الطريق الزراعى,120,متر²,3,2
4079311,شقة للبيع 130م سموحة (سموحة الجديدة )/52,"1,250,000",سموحة الجديدة,130,متر²,3,1
3906218,شقه للبيع 280م دوبلكس امام المحافظه الجديده,"2,500,000",سموحه الجديده,280,متر²,3,3
3819686,شقة للبيع 136 م سموحة الجديدة (خطوات من نادي الاتحاد),"1,050,000",سموحة الجديدة (خطوات من نادي الاتحاد),136,متر²,3,1
3851752,شقة للبيع 145 م سموحة الجديده (كومباوند رواد كابيتال),"1,350,000",كومباوند رواد كابيتال,145,متر²,3,2
3974741,شقه لقطه للبيع بسعر مميز فرصه للسكن و الاستثمار,"550,000",شارع النصر,110,متر²,3,1
4120147,شقة 161 متر مطلات مفتوحة بكمبوند اليكس ستارت سموحة الجديدة,"1,950,000","سموحة, الإسكندرية",161,متر²,3,2
4103412,"شقه للبيع 114 م غرفتين, حمام ,مطبخ ,صاله 3 قطع تشطيب كامل سوبر لوكس","1,450,000",اسكندريه/GOLDS GYM الطريق الزراعي سموحع الجديد/كومباوند اليكس ستارت,114,متر²,2,1
4085424,شقه ١٤٥ متر,"1,560,000",سموحه الجديده,145,متر²,3,2
4099684,شقة للبيع 120م  3غرف وريسبشن وصالة ومطبخ وحمام الدور ال 13 وليس الأخير,"650,000",اسكندريه /بسموحة الجديده/ تبعد دقائق عن نادي الاتحاد الجديد ونادي سبورتنج,120,متر²,3,1
4108079,شقة للبيع 110 متر 2 نوم منهم واحدة بالتكييف - ريسبشن 3 قطع,"900,000",اسكندريه/سموحه الجديده/ترى جرين بلازا خلف قرية عبد المجيد للمشويات,110,متر²,2,1
4090576,شقه ١٨٥ متر سموحه الجديده,"1,900,000",سموحه الجديده بجوار نادي الاتحاد الجديد,185,متر²,4,1
4073751,شقة مميزة للبيع 130 م سموحة,"1,350,000",سموحة الجديدة الاسكندرية,130,متر²,3,1
4040247,شقة 167 متر كمبوند أليكس ستارت سموحة الجديدة تطل مباشرة على الطريق الرئيسى,"2,200,000",سموحه,167,متر²,3,2
4061045,شقة للبيع بسموحة الجديده,"620,000",سموحة الجديده,110,متر²,3,1
4060291,شقه مميزه في اسكندرية,"350,000",الاسكندرية,160,متر²,4,2
3831497,شقه  بمساحه 165متر,"2,062,500",كمباوند جنات سموحه,165,متر²,3,1
4038537,شقة للبيع,"1,450,000","سموحة, الإسكندرية",145,متر²,3,2
4013639,للبيع شقه بدون تشطيب عليها باب شقه فقط مساحتها90م غرفتين كبار وريسبشن قطعتين,"165,000",الاسكندريه سموحه الجديده,90,متر²,2,1
3978125,للبيع شقه مساحه٦٥م سموحه الجديدة,"220,000",الاسكندرية سموحة الجديدة,65,متر²,2,1
3974112,للبيع شقه غرفتين نوم مقفولين وصاله وحمام ومطبخ مساحه٦٥م الدور الرابع,"220,000",الاسكندريه سموحه الجديده,65,متر²,2,1
3955485,شقة  للبيع 60م,"220,000",الاسكندريه_سموحه الجديده,65,متر²,2,1
3875027,شقه ١٤٢ متر نيو سموحه بجوار الجولدز جيم,"1,600,000","سموحة , الاسكندرية",142,متر²,3,2
4035201,شقة للبيع بسموحة الجديده,"620,000",الاسكندرية - سموحة الجديدة,100,متر²,3,1
3958685,شقه للبيع في حي الموظفين الشقه ٩٠متر ثلات غرف وصاله حمام ومطبخ الدور الرابع علوي,"260,000",اسكندريه /سموحه الجديده/حى الموظفين أمام  كوبري أبيس,90,متر²,3,1
3957297,شقة ١١٠ متر للبيع  تشطيب كامل و اسبوتات كهرباء و دواليب مطبخ وحمام الوميتال,"750,000",الاسكندريه - سموحه الجديده,110,متر²,3,1
3955652,شقه للبيع,"220,000",الاسكندريه سموحه الجديده جوار كوبري ابيس علي الطريق الزراعي بين البوابه والكوبري أمام مستشفي الكلى,65,متر²,2,1
3904912,شقه للبيع,"1,625,000",الاسكندرية,155,متر²,3,2
3936285,شقة  للبيع 140م,"550,000",سموحه الجديده,140,متر²,3,2
3935892,شقة للبيع 140م في سموحة الجديدة,"550,000",الاسكندرية كوبري ابيس امام مستشفى الكلى,140,متر²,3,2
3928190,شقه للبيع في الموظفين سموحه الجديدة مساحة 140متر,"550,000",سموحه الجديدة,140,متر²,3,2
3867620,شقة للبيع بسموحة الجديدة بمشروع بيرلا ١ امام مدرسة مصر الحديثة مباشرة الشركة الم,"1,300,000",سموحه,135,متر²,3,1
3920442,شقة  للبيع 140م,"550,000",سموحه الجديده,140,متر²,3,2
3879144,شقة للبيع بجوار نادي الاتحاد,"1,600,000",بجوار نادي الاتحاد فيو مفتوح  سموحة الجديدة  قدام ابراج الصيادلة,145,متر²,3,1
3822305,شقة ١٣٦ متر,"1,100,000",سموحة الجديدة بجوار نادي الاتحاد السكندري,136,متر²,3,1
3848160,شقة بسموحة الجديدة شقة ( 130 ) متر - سوبر لوكس ح معزول بكامل مساحة السطح,"800,000",اسكندريه \سموحه الجديده\بجوار نادي الإتحاد السكندري,130,متر²,3,1
3841058,شقة بمنطقة شرق سموحة,"1,300,000",الاسكندريه - سموحه,185,متر²,3,2
4081982,مك شقه للبيع الترا لوكس 180 متر ريسيبشن بورسلين 3 قطع  3 غرف نوم كبار,"1,750,000",الاسكندرية سموحة الجديدة,180,متر²,3,1
4045780,شقة للبيع بالاسكندرية سموحة الجديدة 110 متر,"620,000",الاسكندرية سموحة الجديدة,110,متر²,3,1
3979973,شقة للبيع  3غرف كبار 1حمام ريسبشن قطعتين سموحه الجديده,"900,000",سموحة الجديدة,120,متر²,3,1
3937975,شقة بسموحه الجديده شارع بطل السلام 135م,"875,000",الاسكندرية سموحه,135,متر²,3,1
3926458,شقه بسموحه الجديده,"900,000",سموحة-اسكندرية,120,متر²,3,1
3857573,شقة ( 130 ) متر - سوبر لوكس,"800,000",سموحة الجديدة  بجوار نادي الإتحاد السكندري,130,متر²,3,1
3851183,شقة ( 130 ) متر - سوبر لوكس,"800,000",سموحة الجديدة بجوار نادي الإتحاد السكندري,130,متر²,3,1
3840972,شقة بسموحة الجديدة,"800,000",بسموحة الجديدة  بجوار نادي الإتحاد السكندري,130,متر²,3,1
3839332,شقه للبيع علي المحموديه مباشرة,"450,000",كومباوند شباب الرمل,90,متر²,2,1
3829375,شقه تمليك مساحة 130 م,"800,000",سموحة الجديدة  بجوار نادي الإتحاد السكندري,130,متر²,3,1
3824126,بسموحة الجديدة بجوار نادي الاتحاد السكندري  وأمام المحافظة ومحكمة الاستئناف,"1,100,000",اسكندريه \بسموحه الجديده\نادى الاتحاد,136,متر²,3,1
3820598,شقة تشطيب سوبر لوكس ٢ غرفة,"1,100,000",سموحة اسكندرية,90,متر²,2,1
4029757,شقة للبيع  ١٣٥ متر تشطيب سوبر لوكس  الدور السابع,"925,000",اسكندريه / سموحة الجديدة مدخل بجانب كومبوند سموحة جرين,135,متر²,3,1
3921375,شقة للبيع 110م في الرابعة الناصرية,"450,000",الاسكندرية سموحة الجديدة خلف نادي الاتحاد,110,متر²,3,1
3863157,شقة لقطة للبيع ١٣٥ متر بسموحة الجديدة تشطيب الترا سوبر لوكس على الفرش مباشرة,"900,000",اسكندريه \سموحه الجديده\شارع بطل السلام بجوار نادي الإتحاد,135,متر²,3,1
3903027,شقة للبيع بسموحة الجديدة  3 غرف مساحة 125 متر دور سادس ومش اخير على الطوب,"430,000",اسكندريه\سموحه الجديده\ تبعد دقائق عن جرين بلازا والمحكمة ونادي الاتحاد ونادي سبورتنج,125,متر²,3,1
