id,title,price,location,size,size_unit,bedrooms,bathrooms
4030075,شقة للبيع ٣ غرف وصالة كرموز,"450,000",كرموز، الاسكندرية,109,متر²,1,1
4131289,شقه١١٠ متر للبيع,"500,000",كرموز,110,متر²,3,1
4129146,شقه للبيع 75 متر,"185,000",الاسكندرية - كرموز - شارع الفنون خلف مدرسة ابراهيم نجيب,75,متر²,2,1
4130324,شقه للبيع 80 متر,"280,000",الاسكندرية - كرموز - أمام عمود السواري,80,متر²,2,1
4129165,شقه للبيع 80 متر,"350,000",الاسكندرية - كرموز - شارع عبد الحميد شبل غيط العنب,80,متر²,3,1
4122207,شقه للبيع 70 متر,"210,000",الاسكندرية - كرموز - شارع محي الدين متفرع من راغب,70,متر²,3,1
4119001,شقه للبيع,"280,000",الاسكندريه كرموز شارع النيل الرئيسي,65,متر²,2,1
4101361,شقة للبيع بالاسكندرية كرموز 80متر,"400,000",الاسكندرية كرموز,80,متر²,3,1
4098861,شقه للبيع مساحتها ٨٠ م,"370,000",الاسكندرية - كرموز - ش عبدالحميد شبل غيط العنب بجوار كنيسه ماريجرجس غيط العنب,80,متر²,3,1
4103092,شقة للبيع بكرموز علي الترام مباني قديمه 4 غرف و صاله,"550,000",كارموز,110,متر²,4,1
4087813,شقة للبيع بالاسكندرية كرموز 105متر,"700,000",الاسكندرية كرموز,105,متر²,3,1
4095554,شقه للبيع 80 متر,"450,000",الاسكندرية - كرموز - شارع النيل,80,متر²,2,1
4071721,شقه للبيع في كرموز سعر لقطه لسرعة البيع,"250,000",كرموز,61,متر²,3,1
4070241,شقة للبيع بكرموز علي الترام مباني قديمه,"550,000",الاسكندرية - كرموز على الترام,110,متر²,4,1
4068807,شقة للبيع 85 متر,"270,000",الاسكندرية - كرموز - عامود السواري,85,متر²,2,1
4067718,شقة للبيع بالاسكندرية كرموز 85 متر,"270,000",الاسكندرية كرموز,85,متر²,2,1
4057622,شقه للبيع  في كرموز,"215,000",كرموز,85,متر²,2,1
4056772,شقة للبيع بالاسكندرية كرموز 85 متر,"380,000",الاسكندرية كرموز,85,متر²,2,1
4045669,شقه للبيع 105 متر,"625,000",الاسكندرية - كرموز - شارع النيل الرئيسي بجوار قهوه الفلاح,105,متر²,3,1
4044052,شقة بكرموز عند عامود السوارى,"270,000",كرموز,85,متر²,2,1
4040009,شقه في ش النيل الرئيسي,"620,000",الاسكندرية - كرموز - شارع النيل الرئيسي,105,متر²,3,1
4037398,شقه ارضى ٣ غرف وصالة ٢ حمام ومطبخ  ٩٠متر,"560,000",الاسكندرية - كرموز ٦شارع القيامة متفرع من شارع النيل بجانب مصنع الحلاوة,90,متر²,3,2
3992777,شقه للبيع,"1,050,000",";vl,. برج المصري على محور مباشرة المحمودية في راغب بجوار كوبري راغب سابقا فوق خالد الحلواني اسكندرية",135,متر²,3,1
3962534,شقة للبيع -كرموز علي الترام,"380,000",كرموز,80,متر²,3,1
3962510,شقه للبيع بشارع ٨,"210,000",شارع ٨ - كرموز,75,متر²,2,1
3924995,شقة للبيع في كرموز علي ترام,"380,000",كرموز علي ترام,80,متر²,3,1
3910558,شقة للبيع  شارع الشيعه,"400,000",شارع الشيعه,90,متر²,2,1
3922068,شقة دوبلكس للبيع بمنطقة غيط العنب شارع الريف,"525,000",غيط العنب شارع الريف,150,متر²,3,1
4061073,شقه للبيع 110 متر,"450,000",الاسكندرية - كرموز - شارع البهي متفرع من شارع 12,110,متر²,3,1
3859735,شقة للبيع بغيط العنب شارع الطابيه الرئيسى,"440,000",الاسكندرية,95,متر²,3,1
3856888,شقة للبيع100متر,"500,000",بشارع اسوان متفرع من ش راغب تاني نمره من الشارع أمام مكتب بريد راغب,100,متر²,3,1
3850659,شقه للبيع ٨٥متر,"260,000",شارع محي الدين ثالث نمره من شارع ١٢ العمومي بجوار صيدليه النقاء,85,متر²,2,1
4039974,للبيع شقة 100 متر,"500,000",الاسكندرية - كرموز,100,متر²,3,1
3841470,شقة للبيع ١٠٠ متر ٣ غرف وصالة قطعتين وحمام ومطبخ وعدادت كهرباء غاز و مياه,"330,000",الاسكندريه كرموز,100,متر²,3,1
3824374,شقه للبيع بشارع اسوان,"500,000",شارع اسوان متفرع من ش راغب تاني نمره من الشارع أمام مكتب بريد راغب,100,متر²,3,1
3974315,شقة 100م للبيع,"750,000",شارع الجزائر الرئيسي اللبان عمارة ابو طلعت الحلواني,100,متر²,3,1
4026927,شقه للبيع كرموز متفرع من شارع 8,"250,000",كرموز متفرع من شارع 8,120,متر²,4,1
3962485,شقه للبيع  اول شارع الرحمة,"170,000",شارع الرحمة- كرموز,60,متر²,2,1
3942364,شقة تمليك للبيع ف شارع محي الدين,"175,000",شارع محي الدين,45,متر²,2,1
3921126,شقة للبيع الدور السابع 90م في كرموز,"550,000",الاسكندرية كرموز,90,متر²,2,1
4045901,شقه للبيع 75 متر,"260,000",الاسكندرية - كرموز - شارع السنين اول نمره من شارع ١٢,75,متر²,2,1
4045633,شقه للبيع 90 متر,"270,000",الاسكندرية - كرموز - شارع خوفو العمومي,90,متر²,3,1
4044410,شقه للبيع عمومي كوم الشقافه,"300,000",كوم الشقافه,120,متر²,3,1
4044395,للبيع شقه فى كرموز,"230,000",كرموز,110,متر²,2,1
3890779,شقة للبيع,"200,000",كرموز,60,متر²,2,1
4059942,شقه للبيع فى شارع السنين,"200,000",شارع السنين - كرموز,75,متر²,2,1
3897111,شقة 110م للبيع,"600,000",ش النيل الرئيسي كرموز,110,متر²,3,1
3884409,شقة للبيع فى كرموز امام عامود السواري,"375,000",كرموز امام عامود السواري,90,متر²,3,1
3846934,شقه للبيع في كرموز اسكندريه بسعر 200 الف جنيه,"200,000",كرموز اسكندريه,70,متر²,2,1
3863520,شقة للبيع ٣ غرف و صالة عداد كهرباء ومياه و غاز على الترام كرموز,"450,000",كرموز,90,متر²,3,1
3831100,دوبلكس  للبيع 130,"330,000",الاسكندريه_كرموز,130,متر²,3,2
4011501,دور خامس بدون اسانسير تشطيب لوكس عداد غاز وعداد مياة خاص بالشقة والكهرباء ممارسة,"330,000",الاسكندريه - كرموز,75,متر²,2,1
4000420,شقه للبيع شارع 12 كرموز,"180,000",شارع 12 كرموز,100,متر²,3,1
3946476,شقة حجرتبن و صالة 2 ق 60م ثلاث نواصي مشمسة طول اليوم جيدة التهوية,"170,000",الاسكندريه كرموز,60,متر²,2,1
3956905,شقة للبيع بكرموز,"350,000",كرموز شارع ابو مندور,100,متر²,4,1
3942244,شقه عالمحور ببلاش,"450,000",كرموز,100,متر²,4,1
3884400,شقه للبيع جميع الخدمات ترى عامود السوارى,"165,000",ترى عامود السوارى,75,متر²,3,1
3928498,شقة تمليك للبيع ف شارع محي الدين الموازي لشارع العمري  خلف مسجد سلطان  مساحة 45,"175,000",الاسكندريه كرموز,45,متر²,2,1
3922101,شقه للبيع شارع الفرغانى شارع الفرغانى,"650,000",شارع الفرغانى,110,متر²,2,1
3849989,شقة بالإسكندرية بمنطقة محرم بك متوفر عندى على 330 الف كاش,"400,000",كرموز,75,متر²,3,1
3857029,شقة للبيع 100متر,"210,000",كرموز شارع قراقوش متفرع من مستشفي البلشي,100,متر²,3,1
3856903,شقة للبيع فى غيط العنب 69متر,"250,000",غيط العنب شارع الراند,69,متر²,3,1
3826330,شقة دوبلكس للبيع مساحة ١٣٠متر,"320,000",الساعة كرموز عالترام مباشرة,130,متر²,3,2
4026526,شقه للبيع في كرموز 65 م,"110,000","كرموز, الإسكندرية",65,متر²,1,2
4021945,شقة 3 غرف دور 2 رخصة بكرموز,"400,000",بكرموز,109,متر²,3,1
3962791,شقة للبيع  بكرموز ( برج الصفا ) على الترام مباشرة ..فوق ايهاب بتاع الدهب 115م,"450,000",الاسكندريه كرموز,115,متر²,3,1
3931060,شقة للبيع 120متر,"450,000",كرموز على الترام مباشر,120,متر²,3,1
3856879,شقه للبيع 70متر,"250,000",اخرالشارع المقابل لبنك مصر وتاني شارع من ناحية شارع 12,70,متر²,2,1
4061190,شقه ايجار قديم شارع 12 عمومى  كرموز,"85,000",كرموز,75,متر²,2,1
3960898,شقة للبيع كرموز,"150,000",الاسكندرية,77,متر²,3,1
3835739,شقة سوبر لوكس للبيع بكرموز الاسكندرية,"300,000",الاسكندرية,75,متر²,3,1
