id,title,price,location,size,size_unit,bedrooms,bathrooms
3958581,شقة للبيع بشارع ايزيس بهاجميع العدادات,"550,000",محرم بيك,110,متر²,2,1
3956991,شقه بمساكن امبروزوا محرم بك,"270,000",مساكن امبروزوا محرم بك علي الترام مباشره أمام مستشفي الحميات,90,متر²,2,1
3949626,شقة لقطة للبيع بمحرم بيك,"590,000",محرم بيك,110,متر²,3,1
3944042,من المالك مباشرة - شقة ١٥٠ م محرم بك علي الترام مباشرة,"1,650,000",الاسكندرية، محرم بك علي الترام مباشرة,150,متر²,3,1
3937725,صور الشقة للي بيسأل السعر ٣٨٠ خامس دور,"380,000",شارع مسجد حجاج امام كلية العلوم ومدرسة اتحاد الجمهوريات,75,متر²,2,1
3926582,شقه للبيع في بوالينو,"250,000",محرم بك-اسكندرية,45,متر²,1,1
3926196,للبيع بأوربا سيتى شقه فرررصه,"950,000",محرم بك- اسكندريه,104,متر²,3,1
3903458,شقه تمليك مساحة 125م,"1,250,000",محرم بك شارع المحكمة,125,متر²,3,1
4040069,شقه للبيع من المالك مباشره,"250,000",الاسكندرية - محرم بك - اخرالشارع المقابل لبنك مصر وتاني شارع من ناحية شارع 12,70,متر²,2,1
3870443,شقة تمليك 110 متر البيع كااااش مرخصة الدورالسابع محرم بك اول نمرة من قناة السويس,"1,300,000",الاسكندريه محرم بك,110,متر²,3,1
3865541,شقه 65متر للبيع,"230,000",اول الفراهده اللبان,65,متر²,2,1
3862978,شقه للبيع فى كمبوند محرم بشا - الاسكندريه,"1,100,000",الاسكندريه,141,متر²,3,1
3851203,شقة للبيع 70 متر,"320,000",محرم بك شارع القمر,70,متر²,2,1
3846350,شقه ( ارضي)بمحرم بك جانبي من عثمان جلال 80متر 3اوض 2كبار و اوضه صغيره وصاله,"350,000",اسكندريه \محرم بك\جانبي من عثمان جلال,80,متر²,3,1
3844581,ستديو للبيع مساكن قناه السويس,"130,000",مساكن قناه السويس,40,متر²,1,1
3845734,شقه لللبيع بمحرم بك,"600,000",الاسكندرية,90,متر²,3,1
3841254,شقة  للبيع 110م,"600,000",الاسكندريه_محرم بك,110,متر²,3,1
3838080,شقة للبيع في محرم بك شارع جرين,"1,700,000",الاسكندرية,165,متر²,3,1
3821962,شقه للبيع فى محرم بيك,"700,000",فى محرم بيك الحدينى مع البلينا,80,متر²,2,1
3984290,شقة للبيع موقع ممتاز بمحرم بك,"650,000",محرم بك-اسكندرية,80,متر²,3,1
3977141,شقة للبيع 80 م موقع ممتاز بمحرم بك,"650,000","محرّم بيك , الاسكندرية",80,متر²,3,1
3932726,شقه للبيع  فى محرم بك,"390,000",محرم بك  شارع امين الرافعى,70,متر²,2,1
3887354,شقه للبيع,"500,000",محرم بك,170,متر²,4,1
3874589,شقه للبيع,"850,000",محرم بك,120,متر²,3,1
3868217,شقة للبيع,"1,500,000",محرم بيك,180,متر²,3,3
3868215,شقة للبيع,"1,400,000",محرم بيك,135,متر²,3,2
3857517,شقه مساحه 115 متر  في غيط الصعيدي,"650,000",غيط الصعيدي أول شارع من ع المحموديه بجوار شركه المياه,115,متر²,3,1
3956064,شقه 60م ف الاسكندرية,"150,000",الاسكندرية,60,متر²,2,1
4014643,شقة للبيع بالاسكندرية  محرم بك 110 متر,"650,000",الاسكندرية محرم بك,110,متر²,3,1
3969871,شقه للبيع غررفتين رسبشن ٣عدادت الدور الرابع اسانسير كاميرات مرقبه,"420,000",الاسكندريه -محرم بك,75,متر²,2,1
3959943,شقه في محرم بك متفرع من بوالينو الدور العاشر  ليس الاخير  فوقيها دور كمان,"625,000",الاسكندريه - محرم بيك,81,متر²,2,1
3952546,شقه لبيع شارع المأمون متفرع من الرصافة وقناه السويس,"1,500,000",الاسكندرية,160,متر²,3,2
3951763,شقه للبيع85متر,"300,000",الدريسه محرم بك,85,متر²,3,1
3944747,شقه للبيع في شارع جرين,"950,000",شارع جرين عمومي,90,متر²,3,1
3855679,للبيع شقه في ارقي منطقه بمحرم بك,"580,000",الاسكندرية,80,متر²,2,1
3851198,للبيع من المالك مباشر شقه ٨٠م,"290,000",امبروزو تاني شارع من الترام,80,متر²,2,1
3844648,شقة للبيع تم تنزيل السعر لسرعة البيع,"200,000",قريبة من الايطالي امبرزوة,90,متر²,2,1
3952215,شقه للبيع بلرصافه خلف مسجد الاصبجي اوضتين وصاله غير مجروحه الدور ١٢ والاخير عاوز,"350,000",الاسكندريه - محرم بيك,70,متر²,2,1
3871084,شقه للبيع بموقع مميز بمحرم بيك,"650,000",الاسكندريه - محرم بيك,90,متر²,3,1
3837573,شقة للبيع محرم بك شارع عرفان الرئيسى غير مجروحة 120م تصلح عروسين,"650,000","محرّم بيك , الاسكندرية",120,متر²,3,1
3943448,شقه بشارع بوالينو العمومي فوق محمصه رزق الدور الثاني,"600,000",الاسكندريه محرم بك,80,متر²,3,1
3908021,شقة للبيع بمحرم بك أمام مدرسة سمير60 متر,"250,000",الاسكندريه محرم بك,60,متر²,3,1
3905520,شقه سكنيه  بمحرم بك  بالدور ١٦ الاخير د ٢- غرفه نوم كبار +ورسيبشن قطعتين اميركان,"285,000",اسكندريه \محرم بك\خطوات من ترام زين العابدين من مدخل سوبر ماركت خليفه تقاطع شارع محفوظ,110,متر²,2,1
3835253,شقه للبيع بمحرم بيك,"420,000",محرم بيك بالرصافه,70,متر²,3,1
3952311,شقة لقطة للبيع امحرم بيك,"640,000",الاسكندريه - محرم بيك,110,متر²,2,1
3870988,شقه للبيع 2غرفه وصاله 55 متر,"180,000",الاسكندريه - محرم بيك,55,متر²,2,1
3969581,شقة دوبليكس للبيع ١٠٠ متر .كل دور ٥٠ متر.,"580,000",خلف مدرسة العباسية.متفرع من شارع جرين,100,متر²,2,2
3924490,الدور التاسع ٣ غرف منهم غرفه ماستر و ريسيبشن ٣ قطع و٢ حمام,"950,000",محرم بك,140,متر²,3,2
4058141,شقة فاخرة للتمليك بمحرم بيك,"1,600,000",شارع محرم بك، محرم بك,100,متر²,2,1
4040477,شقه لقطه لدواعى السفر,"1,800,000",شارع الابعاديه محرم بك,107,متر²,3,1
4117114,شقة للبيع شارع قناة السويس مباشرة,"1,100,000",شارع قنال السويس,70,متر²,4,1
4019660,الاسكندراني محرم بيك,"2,500,000",الاسكندراني محرم بيه,130,متر²,2,1
4124969,استلم شقه في بالم هيلز اسكندرية بمقدم 5% بسعر القديم 151م²,"6,166,000",اسكندريه,151,متر²,3,2
4072431,شقة للبيع 202م صواري (المصرية السعودية),"6,100,000",Suez Canal Rd، Moharram Bey,202,متر²,3,3
4105360,محرم بك,"1,700,000",محرم بك  متفرع من  الترام,125,متر²,3,1
4074259,شقه مميزه داخل كمبوند صواري 145م تطل علي فيوهات مختلفه تقسيط علي 5 سنوات,"4,205,000",كمبوند صواري,145,متر²,3,2
4061567,بدون فوائد امتلك وحدتك السكنيه في صواري بمقدم 10%,"4,235,000",كمبوند صواري,154,متر²,3,2
4045274,شقة للبيع 170 م محرم بك (شارع الظافر)  / p 65,"1,700,000",شارع الظافر,170,متر²,3,1
4045221,شقة للبيع 170 م محرم بك (شارع الظافر) / p65,"1,700,000",شارع الظافر,170,متر²,3,1
4045919,خطوات من ميدان الرصافه وفتح الله بفيو مفتوح محرم بيك,"1,500,000",محرم بيك - ميدان الرصافه,105,متر²,3,1
3970964,شقة تمليك فيو استاد اسكندرية TMZ7222,"3,200,000",محرم بيك,152,متر²,3,2
4031932,شقة للبيع 209 م  بالم هيلز (كومباوند بالم هيلز اسكندرية بالقرب من كارفور سيتي),"8,346,000",Suez Canal Rd، Moharram Bey,209,متر²,4,4
4003478,شقه للبيع 222 متر كلها على الشارع بسعر استثمارى,"2,300,000",المحمودية,222,متر²,3,3
3983119,شقة للبيع 145 م محرم بك (ش قناة السويس),"1,750,000",محرم بك (ش قناة السويس),145,متر²,2,1
4029540,شقة للبيع 90 م محرم بك  ( شارع راغب باشا ),"600,000",شارع راغب باشا,90,متر²,2,1
4011289,شقة 222 متر للبيع كلها على المحمودية,"2,300,000",المحمودية الرئيسى,222,متر²,3,3
4029472,مكتب للبيع 90 م محرم بيك  ( شارع راغب باشا ),"650,000",محرم بيك  ( شارع راغب باشا ),90,متر²,2,1
4097120,المحمودية من جهة شارع العمدة شقة للبيع,"1,100,000",شارع قنال المحمودية البحري، محرم بك,110,متر²,3,1
