id,title,price,location,size,size_unit,bedrooms,bathrooms
3995170,شقة تمليك للبيع من المالك مباشرة,"1,500,000",الاسكندرية - محرم بك - شارع ابن دينار . . من شارع الحلمية تانى نمرة من الترام,145,متر²,3,2
3957009,للتمليك ١٢٥ متر الدور الثاني ميزان -تجاري وسكني,"1,000,000",محرم بك - شارع عرفان الرئيسي,125,متر²,3,1
4052308,شقه للبيع شارع النفوس غربال محرم بك,"420,000",محرم بيك,125,متر²,2,1
3947709,"شقة للبيع 149 م تصلح لجميع الاغراض , شارع المنشا ، محرم بك","1,400,000","محرّم بيك, الإسكندرية",149,متر²,3,1
3958589,بمحور المحموديه مباشر مطلات الشقه داخليه,"900,000",محرم بيك,90,متر²,2,1
4052469,شقه للبيع  محرم بك بوالينو,"250,000",محرم بك بوالينو,75,متر²,2,1
3949990,شقة للبيع١٣٥ متر,"1,000,000",برج المصري على محور مباشرة المحمودية في راغب بجوار كوبري راغب سابقا فوق خالد الحلواني,135,متر²,3,1
3941169,محرم بك اسكندرانى  على المحور مباشرة امام البنزينة ١٢٨م,"950,000",محرم بك اسكندرانى  على المحور مباشرة امام البنزينة,128,متر²,3,1
3923502,شقه في شارع متفرع من قناه السويس ١٠٠ متر ٣اوض ورسبشن كلها وجهات مفتوحه تري البحر,"750,000",اسكندريه /محرم بك/شارع متفرع من قناه السويستري البحر كله وقناه السويس بالكامل  والاستاد ووبور المياه,100,متر²,3,1
3914343,شقة  للبيع 85م,"450,000",محرم بك,85,متر²,2,1
3887356,شقه للبيع,"900,000",محرم بك,86,متر²,2,1
3905703,شقه للبيع 90 متر,"950,000",الاسكندريه محرم بك,90,متر²,2,1
3892860,شقة للبيع في موقع متميز جدا بمحرم بك,"450,000",محرم بك شارع ابن محاسن,65,متر²,3,1
4048211,للبيع شقه تمليك محرم بك شارع محسن امام محور المحمديه 60متر حصه ف الأرض,"170,000",الاسكندرية,60,متر²,2,1
3858818,شقه للبيع,"780,000",محرم بك,120,متر²,4,1
3867469,شقه للبيع في محرم بك شارع ابى هريرة,"450,000",محرم بك شارع ابى هريرة,85,متر²,2,1
3839203,شقة للبيع 145 م بمحرم بك تاني نمرة من الترام,"1,700,000","محرّم بيك , الاسكندرية",145,متر²,3,1
3984000,للبيع شقة تمليك 100م,"650,000",الاسكندرية - محرم بك - ش الأميرى بجوار شركة الغاز  و مكتب العمل تانى نمرة من محور المحمودية,100,متر²,3,1
3825722,شقة مساحة 105 متر صافي,"825,000",أسكندريه محرم بك,105,متر²,3,1
4040060,شقة للبيع محرم بك,"240,000",الاسكندرية - محرم بك - خطوات لمحطة مصر وكلية العلوم الباب الجديد شارع القمر متفرع من يكن,70,متر²,2,1
4040042,شقه للبيع 70 م,"350,000",الاسكندرية - محرم بك - شارع القمر الباب الجديد,70,متر²,2,1
4023563,شقه ٨٥ متر  ٢ غرفه ٣.٥*٣.٥ رسيبشن قطعتين ٨*٣.٥,"600,000",الأسكندرية - محرم بك شارع الفرغانى  متفرع من شارع محسن,85,متر²,2,1
4023593,شقه تمليك في امبروز,"210,000",الاسكندرية - محرم بك - امبروز - عند مستشفى الإيطالي شارع الكنيسه,45,متر²,2,1
4015301,شقة للبيع بالاسكندرية محرم بك 115 متر,"1,200,000",الاسكندرية محرم بك,115,متر²,3,1
4017488,شقة لقطة للبيع بمحرم بيك,"650,000",محرم بيك,100,متر²,2,1
4000677,شقه للبيع ٨٠ متر,"600,000",محرم بك - المحور مباشرة بين الاسكندراني والكمال,80,متر²,3,1
4000765,شقه بمحرم بك - بوالينو,"1,550,000",محرم بك-اسكندرية,160,متر²,3,2
3997335,بمحرم بك متفرع من شارع اسكندراني دقايق لمحور المحمودية ١١٥  متر صافي,"500,000",بمحرم بك - متفرع من شارع اسكندراني - دقايق لمحور المحمودية,115,متر²,2,1
3997220,شقة للبيع بمحرم بيك مساحة ١١٠ متر,"690,000",محرم بيك شارع بشارع محسن أمام عبد العال حسن بتاع الموبيليا,110,متر²,3,1
3994510,شقة للبيع بالاسكندرية محرم بك 80  متر,"570,000",الاسكندرية محرم بك,80,متر²,2,1
3988344,للبيع شقه مساحه ١٠٠ متر ٣ اوض ورسبشن الدور ١٧ وليس الاخير يوجد دور وسطح,"750,000",اسكندريه/محرمبك/  شارع متفرع من قناه السويس في اخر سلم قبل النفق,100,متر²,3,1
3987260,محرم بك - متفرع من شارع اسكندراني شقة ١١٥  متر صافي,"500,000",بمحرم بك - متفرع من شارع اسكندراني - دقايق لمحور المحمودية,115,متر²,2,1
3981841,شقة تمليك للبيع من المالك 145م محرم بك,"1,500,000",الاسكندرية محرم بك,145,متر²,3,2
3971690,للبيع شقه تمليك مساحة ١٠٠ م,"650,000",٧ش الأميرى بجوار شركة الغاز,100,متر²,3,1
3969494,شقة للبيع 95 م محرم بيه,"580,000","محرّم بيك, الإسكندرية",95,متر²,3,1
3966560,شقة للبيع بالاسكندرية محرم بك 85متر,"650,000",الاسكندرية محرم بك,85,متر²,2,1
3966488,شقه للبيع متر٣اوض ورسبشن كلها وجهات مفتوحه  الدور ١٧ وليس الاخير ٢٠١٥,"750,000",اسكندريه/محرم بك/شارع متفرع من قناه السويس/ تري قناه السويس بالكامل والاستاد ووبور الميه والبحر والشلالات,100,متر²,3,1
3962616,شقه للبيع من المالك مباشره جديده 165 متر,"1,800,000",محرم بك - خلف فتح الله وابور المياه,165,متر²,3,1
3950227,شقه للبيع 100 متر,"1,000,000",الاسكندريه محرم بك,100,متر²,3,1
3942062,شقه للبيع في شارع متفرع من قناه السويس ١٠٠متر٣اوض,"750,000",محرم بيك,100,متر²,3,1
3894131,شققة للبيع في موقع متميز جدا بمحرم,"450,000",الاسكندريه - محرم بك,65,متر²,3,1
3940924,للبيع - شقة 130 م 3 غرف و ريسيبشن,"395,000",الاسكندريه محرم بك,130,متر²,2,1
3940927,شقه راقيه بعماره البركه محرم بك اول علوي متفرع من منشا جديده مرخصه,"1,940,000",الاسكندريه محرم بك,140,متر²,3,2
3940928,شقة للبيع ٨٠م محرم بك قرب المحمودية,"790,000",الاسكندريه محرم بك,80,متر²,2,1
3928808,شقه للبيع مساحه ١٠٠ متر ٣ غرف وريسبشن قطعتين  بها عداد مايه وعداد كهرباء,"490,000",اسكندريه /محرم بك/شارع المقداد متفرع من شارع يكن,100,متر²,3,1
3928170,للبيع في محرم بك الغيط الصعيدى شقه ٨٥متر الدور الخامس,"450,000",محرم بك الغيط الصعيدى,85,متر²,2,1
3935953,شقه سكنيه ١١٥ متر ٣ غرف وريسبشن قطعتين وحمام ومطبخ كلها تطل على الشارع,"1,350,000",محرم بك-اسكندريه,115,متر²,3,1
3923374,شقه للبيع مساحه ١٠٠ متر ٣ غرف وريسبشن قطعتين و علي المحارة ا,"490,000",اسكندريه/محرم بك شارع المقداد متفرع من شارع يكن,100,متر²,3,1
3924906,شقة  للبيع 130م,"900,000",محرم بك,130,متر²,3,1
3924909,شقة  للبيع 110م,"580,000",محطة مصر_وسط البلد,110,متر²,3,1
3924485,شقة 65 متر للبيع ب 360 الف بمحرم بيه قريبة من الترام  عدادات مياه و كهربا و غاز,"360,000",محرم بك,65,متر²,2,1
3924484,شقة للبيع في موقع متميز جدا بمحرم بك شارع ابن محاسن أمام فتح الله ماركت ، مساحة,"450,000",محرم بك,65,متر²,2,1
3923492,شقه للبيع محرم بك 65 متر,"450,000",الاسكندرية محرم بك,65,متر²,3,1
3868042,شقه للبيع من المالك,"2,300,000",الاسكندريه - محرم بيك,175,متر²,3,2
3909273,شقه تمليك مساحة 85م,"450,000",محرم بك شارع ابى هريرة,85,متر²,2,1
3907466,شقه في شارع متفرع من قناه السويس ١٠٠ متر ٣اوض ورسبشن كلها وجهات مفتوحه,"750,000",اسكندريه \محرم بك\تري قناه السويس بالكامل  والاستاد ووبور الميه  والبحر والشلالات,100,متر²,3,1
3847832,شقة للبيع راغب على محور المحمودية,"1,100,000",راغب على محور المحمودية,135,متر²,3,1
3897137,شقه تمليك مساحة 85م,"450,000",محرم بك شارع ابى هريرة,85,متر²,2,1
3897157,شقة 120 متر في موقع متميز جدا,"1,150,000",كمبوند حي محرم باشا,120,متر²,3,1
3882676,من المالك مباشر محرم بك بوالينو علي الترام رئيسي برج البركة بلازا مساحة ١٧٥ متر,"2,300,000",الاسكندريه محرم بك,175,متر²,3,1
3870731,من المالك مباشره شقه للبيع ٢غرفه ريسبشن قطعتين مطبخ وحمام,"650,000",الاسكندريه - محرم بيك,75,متر²,2,1
3869313,من المالك مباشره شقه للبيع ٢غرفه,"650,000",محرم بك شارع الاسكندراني,75,متر²,2,1
3868048,شقه تمليك مساحة 85 م,"450,000",محرم بك شارع ابى هريرة تانى شارع بعد شركة المياه,85,متر²,2,1
3859299,شقة مساحة 105 متر صافي 3 غرف وريسبشن و مطبخ وحمام  ... ريسبشن وغرفتين عالشارع..,"825,000",اسكندريه \محرم بك\بين شارع مسجد الحضري و بين شارع ابن الخطاب...جمب عمو فؤاد و اوكازيون,105,متر²,3,1
3857514,بسعر لقطة شقة للبيع.,"450,000",محرم بك علي شارع امين الرافعى,70,متر²,2,1
3856894,شقة للبيع 70متر,"350,000",شارع القمر الباب الجديد محرم بك,70,متر²,2,1
3855674,شقة للبيع لؤطه محرم بك محور المحمودية,"800,000",محرم بك محور المحمودية,110,متر²,3,1
3855672,شقه للبيع  رابع عمارة من ش محرم بك الرئيسي,"1,100,000",محرم بك,100,متر²,2,1
3851180,شقه تمليك مساحة 85 م,"450,000",محرم بك شارع ابى هريرة تانى شارع بعد شركة المياه,85,متر²,2,1
3851159,شقه تمليك مساحة ١٠٠ م,"650,000",محرم بيك شارع حافظ ابطان ناحيه محطه مصر,100,متر²,2,1
3851050,شقة110 غير مجروحه مشمسة طول اليوم عدد3غرف ورسيبشن كاملة العدادات كهرباء وغاز,"800,000",اسكندريه \محرم بك\محور المحمودية,110,متر²,3,1
3848092,شقه للبيع بمحرم بك,"750,000",محرم بك,120,متر²,3,1
3841467,للبيع في محرم بك الغيظ الصعيدى ٨٥متر الدور الخامس بدون اسانسير وليس الاخير,"450,000",الاسكندريه محرم بك,85,متر²,2,1
3843021,شقه للبيع بمحرم بك,"850,000",العنوان شارع جميل ثابت متفرع من شارع ايزيس محرم بك,105,متر²,3,1
3836992,شقه للبيع,"4,200,000",الاسكندرية,201,متر²,3,2
3829371,شقة مساحة 105 متر صافي,"825,000",بين شارع مسجد الحضري و بين شارع ابن الخطاب,102,متر²,3,1
4000772,شقة ١٦٠ متر خطوات من قناة السويس كاملة التشطيبات,"1,850,000",محرم بك-اسكندرية,160,متر²,3,2
3974584,شقة مشمسة و جيدة التهوية ١١٥ متر,"520,000",الاسكندرية - محرم بك - متفرع من شارع اسكندراني قبل المحمودية,115,متر²,2,1
3944774,شقه للبيع  مساحه 110 متر,"750,000",محور المحموديه بعد شركه الغاز بعد كوبري راغب,110,متر²,3,1
3941265,شقة لؤطه محرم بك محور المحمودية الترا سوبر لوكس,"800,000",محرم بك محور المحمودية,110,متر²,3,1
3941770,شقة لؤطه محرم بك محور المحمودية  الترا سوبر لوكس,"800,000",محرم بك محور المحمودية,110,متر²,3,1
3941766,شقة لؤطه محرم بك,"800,000",محرم بك محور المحمودية,120,متر²,3,1
3903460,شقه تمليك مساحة 90 م,"970,000",شارع جرين عمومي,90,متر²,3,1
3897131,شقه تمليك مساحة 90 م,"970,000",شارع جرين,90,متر²,3,1
3887353,شقه للبيع,"470,000",محرم بك,70,متر²,2,1
3869314,شقة للبيع  بدون سمسار من المالك مباشرة المساحة :135 متر,"1,100,000",راغب على محور المحمودية,135,متر²,3,1
3857557,شقه 110متر تمليك للبيع,"650,000",شارع حافظ باطن الباب الجديد محرم بك,110,متر²,2,1
3859727,شقه للبيع,"450,000",محرم بك,100,متر²,2,1
4087303,اعلان عن شقه بالاسكندريه,"850,000",الاسكندرية,95,متر²,3,1
4070620,شقة للبيع بالاسكندرية محرم بك 150 متر,"1,250,000",الاسكندرية محرم بك,150,متر²,3,2
4080962,للبيع بمحرم بك شارع الاسكندراني,"600,000",الاسكندرية - محرمبك شارع الاسكندراني,120,متر²,2,1
4080885,شقة لقطة للبيع بمحرم بيك,"650,000",الاسكندرية - محرم بك - أمام شارع عرفان فوق صيدلية دكتور معتز حنفي اول نمرة من ش محسن تقاطع ش بدر مع ش يعقوب,110,متر²,2,1
4073957,شقة للبيع 120متر,"750,000",الاسكندرية - محرم بك - شارع الامير مصطفي,120,متر²,3,1
4068966,شقة حجرتين وصالة قطعة واحدة مساحة 57 الى 60 تقريبا  تشيط لوكس عداد غاز و كهرباء,"350,000",محرم بك,57,متر²,2,1
4081760,شقة للبيع محرم بك متفرع من شارع اسكندراني بجوار نادي  الساحة,"750,000",الاسكندرية -  محرم بك متفرع من شارع اسكندراني بجوار نادي  الساحة رابع عماره من شارع اسكندراني شارع محمد الطوخي سعيد,110,متر²,2,1
4062157,شقة لقطة للبيع,"1,500,000",الاسكندرية,153,متر²,3,1
4045961,شقه للبيع 100 متر,"500,000",الاسكندرية - محرم بك - اول نمره من راغب وشارع 12 غير مجروحه نهاءى ترى شارع ايزيس بوضوح,100,متر²,3,1
4059702,شقه للبيع 57 متر,"200,000",الاسكندرية -  تاني نمرة من قناة السويس وقريبة من كوبري محرم بك,57,متر²,2,1
4015290,شقة للبيع,"700,000",الاسكندرية,100,متر²,2,1
3997879,شقه للبيع محرم بك,"800,000",الاسكندرية - محرم بك - الرصافة,90,متر²,2,1
4042708,شقه للبيع 65 متر,"500,000",الاسكندرية - محرم بك - أبراج القضاه الرصافه ع الترام بعد فتح الله ماركت,65,متر²,2,1
4056921,شقة للبيع بالاسكندرية محرم بك110 متر,"450,000",الاسكندرية محرم بك,110,متر²,3,1
4022146,شقه ١٠٠ متر ٣ غرف ورسيبشن كبير تطل علي المحموديه اول شارع الزهور,"550,000",المحموديه اول شارع الزهور,100,متر²,3,1
4013938,شقه 85 متر 2 غرفه ورسبشن 2 قطعه عددات كامله,"130,000",كفر عشري كوبري التاريخ اول طريق المحموديه عمومي,85,متر²,2,1
3991034,شقة للبيع بالاسكندرية محرم بك100 متر,"710,000",الاسكندرية محرم بك,100,متر²,2,1
3995319,شقة للبيع بالاسكندرية محرم بك 64 متر,"250,000",الاسكندرية محرم بك,64,متر²,2,1
3991032,شقة للبيع بالاسكندرية محرم بك 100 متر,"710,000",الاسكندرية محرم بك,100,متر²,3,1
3976260,شقة للبيع بالاسكندرية المحمودية 140  متر,"750,000",الاسكندرية المحمودية,140,متر²,3,1
3968024,شقة للبيع في محرم بك 80 م,"255,000",ش الاسكندراني بجانب ساحه الحريه,80,متر²,2,1
3958586,شقه دوبلكس بسلم داخلى مكونه من طبقين 9و10,"825,000",محرم بيك,130,متر²,3,2
3946508,المساحه 220 متر ريسيبشن كبير 4 قطع وبلكونه ريسبشن كبيره وغرفه سفره منفصله,"2,600,000",اسكندريه/محرم بك/بكومبوند حى محرم باشا,220,متر²,4,2
3944778,مساكن قناة السويس الدور الخامس والأخير تشطيب سوبر لوكس,"220,000",مساكن قناة السويس,65,متر²,2,1
3943456,شقه بكمبوند للبيع,"1,500,000",الاسكندريه محرم بك,139,متر²,3,2
3932932,شقة للبيع محرم بك خطوات لمحطة مصر,"240,000",محرم بك,70,متر²,2,1
3931251,شقه للبيع محرم بك الرصافة شارع ابن محاسن,"450,000",محرم بك الرصافة شارع ابن محاسن,65,متر²,3,1
3931870,شقة تشطيب سوبر لوكس,"1,000,000","محرّم بيك, الإسكندرية",115,متر²,3,1
3914394,شقه للبيع في محرم بك خلف سور الحميات,"160,000",الاسكندريه_ محرم بك,45,متر²,1,1
3909283,شقه تمليك مساحة 125 م,"1,250,000",محرم بك شارع المحكمة,125,متر²,3,1
3907111,شقه للبيع,"520,000",الاسكندريه محرم بك أمام مدرسه النهضة,90,متر²,2,1
3902870,شقة للبيع تمليك بمحرم بك بشارع متميز تشطيب سوبر لوكس من المالك مباشرة,"410,000",الاسكندريه محرم بك,70,متر²,2,1
3893811,شقة لؤطه محرم بك محور المحمودية الترا سوبر لوكس  شقة110 غير مجروحه مشمسة طول الي,"800,000",محرم بك,110,متر²,3,1
3882428,شقة للبيع فى ارقي شوارع محرم بك 50 م   ٢ غرف وصالة  وحمام ومطبخ متشطبة يوجد جميع,"365,000",محرم بك,50,متر²,2,1
3871016,شقه تمليك مساحة 85 م,"450,000",محرم بك شارع ابى هريرة تانى شارع بعد شركة المياه بشرعين وكوبرى محرم بك,85,متر²,2,1
3871032,شقه تمليك مساحة 65م,"460,000",الرصافة ش ابن محاسن المقابل لفتح الله,65,متر²,3,1
3869317,بسعر لقطة شقة للبيع محرم بك,"410,000",محرم بك  علي شارع امين الرافعى,70,متر²,2,1
3859061,شقه ١٠٠ متر غرفتين وصاله رسبشن قطعتين الدور الرابع سلم البيت من سنه ١٩٩٥,"500,000",اسكندريه\محرم بك\شارع ابن محاسن محرم بك رقم ٣٥,100,متر²,2,1
3851181,للبيع شقة 150 متر 4 غرف وصالة,"850,000",بوالينو اول موازي لترام محرم بك,150,متر²,4,1
3846264,شقه للبيع 95م,"500,000",الاسكندريه 10ش القمر الباب الجديد محرم بك,95,متر²,2,1
3844763,شقة الدور الاول ٤٠م,"130,000",مساكن قناة السويس,40,متر²,1,1
3844615,شقه للبيع لقطه علي المحمودية,"695,000",نطقة راغب أمام محطة اتوبيس راغب علي المحمودية,107,متر²,3,1
3827799,للبيع شقه شيك ڤيو رائع,"1,800,000",اسكندريه محرم بك,140,متر²,3,2
3952171,للبيع شقه شارع بدر الجمال,"450,000",شارع بدر الجمال امبروزو أمام المعهد الفني الصحي,120,متر²,3,1
3921837,شقه من المالك مباشر ة محرم بك عمارات كرام ٩٠ م,"800,000",الاسكندريه _ محرم بك,90,متر²,2,1
3909275,شقه تمليك مساحة 125 م,"750,000",راغب باشا,125,متر²,3,1
3887357,شقه للبيع,"1,100,000",محرم بك,135,متر²,3,1
3873407,شقه للبيع,"600,000",محرم بك,110,متر²,3,1
3869615,شقة للبيع,"130,000",محرم بيك,60,متر²,2,1
3860084,شقه للبيع محرم بيك شارع المناخ متفرع من شارع اسكندراني 70 م,"330,000",الاسكندريه - محرم بيك,70,متر²,2,1
3837556,شقه 85 م بمحرم بك مساكن قناه السويس,"330,000","محرّم بيك , الاسكندرية",85,متر²,2,1
4122351,شقة للبيع بالاسكندرية محرم بك  100 متر,"300,000",الاسكندرية محرم بك,100,متر²,2,1
4111468,شقة للبيع بالاسكندرية محرم بك 120 متر,"620,000",الاسكندرية محرم بك,120,متر²,4,1
4068979,شقة للبيع 130 م٢ محرم بك ( محور المحمودية ) وسط مدينة الإسكندرية   4 ش ابن عتيق,"700,000",محرم بك,130,متر²,3,1
4062927,شقه للبيع,"800,000",الاسكندريه بمحرم بك بين محطة مصر و شارع محرم بك و محور المحمودية الجديد,120,متر²,3,1
4056990,شقة للبيع بالاسكندرية محرم بك 120 متر,"650,000",الاسكندرية محرم بك,120,متر²,3,1
4061065,شقه للبيع 75 متر,"250,000",الاسكندرية - محرم بك - بوالينو شارع ابن القصير متفرع من عرفان,75,متر²,2,1
4049803,شقة للبيع,"1,000,000",الاسكندرية محرم بك,135,متر²,3,1
4041156,شقة للبيع بالاسكندرية محرم بك 141 متر,"1,200,000",الاسكندرية محرم بك,141,متر²,3,2
4038888,للبيع .....  شقه تمليك مساحة ١٠٠ م * سنة البناء ٢٠١١  * الدور السابع - أسانسير,"750,000",الاسكندريه محرم بك,100,متر²,3,1
4031182,شقق فى شارع محرم بك 110 متر² لوكس للبيع,"650,000",محرم بك,110,متر²,3,1
4026854,شقة للبيع قلب محطه مصر اول محرم بيك,"550,000",محرم بك-اسكندرية,90,متر²,3,1
4026653,للبيع شقه 65م مكونه من غرفتين وصاله ومطبخ وحمام وعداد كهرباء ومياه الدور التاني,"155,000",الاسكندرية - محرم بك شارع الدريسه عند بتوع الرخام,65,متر²,2,1
4024696,شقة للبيع بالاسكندرية محرم بك110 متر,"650,000",الاسكندرية محرم بك,110,متر²,3,1
4017703,شقق سوبر لوكس فى شارع عرفان,"460,000",الاسكندريه بمحرم بك متفرع من شارع عرفان,72,متر²,2,1
4011314,شقة لقطة للبيع او للايجار بمحرم بيك,"690,000",محرم بك-اسكندرية,110,متر²,3,1
4007243,شقه للبيع,"690,000",الاسكندريه محرم بك أمام شارع عرفان فوق صيدلية دكتور معتز حنفي,100,متر²,3,1
4000726,شقة لقطة للبيع في محرم بك,"600,000",محرم بك-اسكندرية,90,متر²,2,1
4000730,شقه للبيع حصه بالأرض من المالك مباشر بدون وسيط غرفتين كبارورسبشين٣قطع,"580,000",محرم بك-اسكندرية,140,متر²,2,1
3998350,شقه سوبر لوكس للبيع الموظفين بجوار جامع الموظفين بعد نادي الاتحاد الجديد 90 متر,"240,000",محرم بك - الموظفين بجوار جامع الموظفين بعد نادي الاتحاد الجديد,90,متر²,3,1
3997301,شقة للبيع بالاسكندرية محرم بك 110متر,"690,000",الاسكندرية محرم بك,110,متر²,3,1
3987358,شقه بلرصافه للبيع,"400,000",الرصافه,70,متر²,2,1
3985405,شقة للبيع بالاسكندرية محرم بك 110متر,"690,000",الاسكندرية محرم بك,110,متر²,3,1
3983694,شقة للبيع  غرفتين وصاله 75 م,"250,000",الاسكندرية - محرم بك - والينو شارع ابن القصير متفرع من عرفان,75,متر²,2,1
3972483,شقة ١١٠متر كاملة العدادات,"750,000",محرم بك اخر شارع المنزلاوي قريب جدا من الترام والشهر العقاري والمحكمة,110,متر²,3,1
3969703,للبيع .....  شقه تمليك مساحة ١٠٠ م * سنة البناء ٢٠١١  * الدور السابع - أسانسير *,"650,000",الاسكندريه محرم بك,100,متر²,3,1
3961434,شقة للبيع في الاسكندريه محرم بك من المالك,"400,000",محرم بك,65,متر²,3,1
