id,title,price,location,size,size_unit,bedrooms,bathrooms
4058141,شقة فاخرة للتمليك بمحرم بيك,"1,600,000",شارع محرم بك، محرم بك,100,متر²,2,1
4040477,شقه لقطه لدواعى السفر,"1,800,000",شارع الابعاديه محرم بك,107,متر²,3,1
4117114,شقة للبيع شارع قناة السويس مباشرة,"1,100,000",شارع قنال السويس,70,متر²,4,1
4019660,الاسكندراني محرم بيك,"2,500,000",الاسكندراني محرم بيه,130,متر²,2,1
4124969,استلم شقه في بالم هيلز اسكندرية بمقدم 5% بسعر القديم 151م²,"6,166,000",اسكندريه,151,متر²,3,2
4072431,شقة للبيع 202م صواري (المصرية السعودية),"6,100,000",Suez Canal Rd، Moharram Bey,202,متر²,3,3
4105360,محرم بك,"1,700,000",محرم بك  متفرع من  الترام,125,متر²,3,1
4074259,شقه مميزه داخل كمبوند صواري 145م تطل علي فيوهات مختلفه تقسيط علي 5 سنوات,"4,205,000",كمبوند صواري,145,متر²,3,2
4061567,بدون فوائد امتلك وحدتك السكنيه في صواري بمقدم 10%,"4,235,000",كمبوند صواري,154,متر²,3,2
4045274,شقة للبيع 170 م محرم بك (شارع الظافر)  / p 65,"1,700,000",شارع الظافر,170,متر²,3,1
4045221,شقة للبيع 170 م محرم بك (شارع الظافر) / p65,"1,700,000",شارع الظافر,170,متر²,3,1
4045919,خطوات من ميدان الرصافه وفتح الله بفيو مفتوح محرم بيك,"1,500,000",محرم بيك - ميدان الرصافه,105,متر²,3,1
3970964,شقة تمليك فيو استاد اسكندرية TMZ7222,"3,200,000",محرم بيك,152,متر²,3,2
4031932,شقة للبيع 209 م  بالم هيلز (كومباوند بالم هيلز اسكندرية بالقرب من كارفور سيتي),"8,346,000",Suez Canal Rd، Moharram Bey,209,متر²,4,4
4003478,شقه للبيع 222 متر كلها على الشارع بسعر استثمارى,"2,300,000",المحمودية,222,متر²,3,3
3983119,شقة للبيع 145 م محرم بك (ش قناة السويس),"1,750,000",محرم بك (ش قناة السويس),145,متر²,2,1
4029540,شقة للبيع 90 م محرم بك  ( شارع راغب باشا ),"600,000",شارع راغب باشا,90,متر²,2,1
4011289,شقة 222 متر للبيع كلها على المحمودية,"2,300,000",المحمودية الرئيسى,222,متر²,3,3
4029472,مكتب للبيع 90 م محرم بيك  ( شارع راغب باشا ),"650,000",محرم بيك  ( شارع راغب باشا ),90,متر²,2,1
4097120,المحمودية من جهة شارع العمدة شقة للبيع,"1,100,000",شارع قنال المحمودية البحري، محرم بك,110,متر²,3,1
4041434,للبيع - شقق 155 متر² _super_lux,"1,800,000",شارع البلينا، محرم بك,155,متر²,1,1
3845598,شقة للبيع 120م  محرم بك (علي الترام مباشره),"1,700,000",محرم بك (علي الترام مباشره),120,متر²,3,1
3851599,شقة للبيع 180م بــــ محرم بيك علي محور المحمودية (بالاسكندرية),"1,650,000",محرم بيك ع محور المحمودية مباشر,180,متر²,3,2
3825408,شقة للبيع بالدواليب والتكيفات145م بــ محرم بيك تاني نمرة علي الترام (بالاسكندرية,"1,700,000",محرم بيك تاني نمرة م الترام,145,متر²,3,2
3877724,شقة للبيع,"1,300,000",شارع المامون محرم بك,100,متر²,3,1
4105923,شقه سوبر لوكس,"1,300,000",شارع الرصافة، محرم بك,87,متر²,1,1
3896552,موقع مميز محرم بك خطوات من ميدان الرصافه ومستشفى حساب,"1,690,000",ش جرين محرم بك,125,متر²,3,1
3886950,شقق فى شارع قنال المحمودية البحري 140 متر² super_lux للبيع,"950,000",شارع قنال المحمودية البحري، محرم بك,140,متر²,3,1
4029659,للبيع بارقي منطقة محرم بك من المالك ٩٠٠ الف كاش,"900,000",شارع الرصافة، محرم بك,70,متر²,9,1
4049818,شقة للبيع,"600,000",ش بوالينو محرم بك اسكندرية,90,متر²,2,1
3903094,شقة للبيع تقاطع شارع قنال السويس مع قنال المحمودية,"900,000",2 شارع قنال السويس - محرم بك,90,متر²,3,1
3982122,شقة 3 غرف على قناة السويس مباشرة,"750,000",شارع قناة السويس محرم بك,100,متر²,3,1
3978444,شقة لقطه الترا سوبر لوكس غير مجروح محرم بك طريق المحمودية,"800,000",شارع المهدى العباسى بجوار مدرسة الجزائر عند بطلس للكوتش,110,متر²,3,1
4029542,للبيع ارقي منطقة محرم بك من المالك ٩٠٠ الف كاش,"900,000",شارع الرصافة، محرم بك,70,متر²,9,1
3811122,شقة 124م بدون تشطيب بمحرم بك,"1,000,000",طريق المحمودية / محرم بك,124,متر²,3,1
3929505,شقة للبيع 100 م محرم بك (كومباوند اوريا سيتي بجوار محرم باشا),"1,100,000",محرم بك (كومباوند اوريا سيتي بجوار محرم باشا),100,متر²,3,1
3836767,شقة للبيع 100 م محرم بك (كومباوند اوريا سيتي بجوار محرم باشا),"1,100,000",محرم بك (كومباوند اوريا سيتي بجوار محرم باشا),100,متر²,3,1
3934492,للبيع - شقق 160 متر² سوبر لوكس,"1,400,000",شارع قنال المحمودية البحري، محرم بك,160,متر²,4,2
3844599,شارع عبدالغفار متفرع من شارع بوالينو محرم بك,"250,000",بوالينو شارع عبد الغفار  مجرم بك,58,متر²,2,1
3847914,شقة لقطه الترا سوبر لوكس غير مجروح محرم بك طريق المحمودية,"800,000",محرم بك طريق المحمودية,110,متر²,3,1
3839231,شقه للبيع بمحرم بك شارع اسكندرانى,"550,000",حسن الاسكندرانى,80,متر²,3,1
3832728,شقه للبيع بمحرم بك شارع اسكندرانى,"550,000",حسن الاسكندرانى,80,متر²,3,1
4060073,شقق 130 متر² للبيع فى شارع محرم بك,"650,000",شارع محرم بك، محرم بك,130,متر²,3,1
4016158,3 غرف محرم بك موقع متميز (واجهتين) حصة في الأرض دور تاني مالك أول,"650,000",شارع أمين الرافعي,95,متر²,3,1
3907973,شقة بشارع الناصر محمد عند كوبري مشاه قناة السويس وجه بحري ٣ غرف وريسيبشن قطعتين أمام مساكن قناة السويس برج السعد,"1,000,000",شارع محرم بك، محرم بك,105,متر²,3,1
4020681,شارع الابعدية,"750,000",شارع الرصافة، محرم بك,80,متر²,2,1
3989880,شقة لقطة للبيع او للايجار بمحرم بيك,"690,000",ش محسن أمام عبد العال حسن موبيليا,110,متر²,3,1
3861060,شقه تمليك للبيع,"250,000",شارع عبد الغفار متفرع من شارع بوالينو محرم بك,58,متر²,2,1
3963671,شقة لللبيع,"400,000",شارع الزاهر متفرع من مسجد حجاج,80,متر²,2,1
4133076,شقة للبيع 70 متر,"450,000",الاسكندرية - محرم بك - شارع ابن قصير اخر بوالينو المقابل لعرفان,70,متر²,2,1
4132777,شقق سوبر لوكس فى شارع قنال المحمودية البحري,"1,170,000",الاسكندريه محرم بك الرصافة البر القبلى  محور المحمودية مباشر عند الملف اعلى صيدلية نور ومكتب سارة للسياحة والرحلات,140,متر²,3,1
4131173,شقه للبيع,"900,000",الاسكندريه محرم بك متفرع من شارع عرفان,90,متر²,2,1
4131317,شقه ٨٠متر للبيع الدور الاخير,"400,000",محرم بك,80,متر²,3,1
4129323,شقه للبيع في محرم بك -الرصافه,"800,000",محرم بك,90,متر²,2,1
4128464,شقه لقطه للبيع,"550,000",اسكندريه محرم بك,80,متر²,2,1
4123390,شقة مساحة 130 م2 محرم بيك شارع موازى لشارع اسكندرانى,"1,200,000",محرم بيك,130,متر²,2,1
4123383,شقة مساحة 140متر غير مجروحة بحرى متشطبة بالكامل,"1,650,000",محرم بيك,140,متر²,3,1
4122541,شقتين مفتوحين على بعض ٢٠٠م  للبيع من المالك مباشر,"2,800,000",محرم بيك,200,متر²,3,2
4122363,شقه للبيع  ٩٠م ٢ غرفة و ريسبشن قطعتين وحمام ومطبخ دور ١٣ وليس الاخير,"900,000",اسكندريه /محرم بك متفرع من شارع عرفان برج اللوتس,90,متر²,2,1
4122542,للبيع شقة ١٤٠ متر تشطيب كامل ٣غرف نوم/ صالة ٣غرف/ ٢حمام,"1,350,000",محرم بيك,140,متر²,3,2
4121221,شقة للبيع بالاسكندرية محرم بك 90متر,"900,000",الاسكندرية محرم بك,90,متر²,2,1
4117387,شقة للبيع بالاسكندرية محرم بك 85 متر,"530,000",الاسكندرية محرم بك,85,متر²,2,1
4119399,شقه للبيع  120 متر الدور التاني عماره 11 دور الدور شقه واحده 3 غرف كبار جدا,"750,000",اسكندريه/محرم بك متفرعه من عرفان واسكندراني والمحور شارع الامير مصطفي شارع اولو عرفان الرئيسي,120,متر²,3,1
4123411,شقة تمليك بحصة عقارية في الارض الدور الثالث وليس الاخير,"260,000",محرم بيك,65,متر²,2,1
4122687,شقة لقطة للبيع بمحرم بيك,"650,000",محرم بيك,110,متر²,3,1
4098975,شقه للبيع شارع النفوس غربال محرم بك بجوار كنيسه الملاك ميخائيل,"400,000",الاسكندرية - محرم بك -  شارع النفوس غربال بجوار كنيسه الملاك ميخائيل فوق ماجو للتجاره,85,متر²,3,1
4110546,شقة للبيع في محرم بك علي الشارع الرئيسي,"1,100,000",الاسكندرية -  محرم بك علي الشارع الرئيسي,110,متر²,3,1
4122214,شقة للبيع بالاسكندرية محرم بك 145متر,"1,350,000",الاسكندرية محرم بك,145,متر²,3,2
4099118,شقة للبيع بالاسكندرية محرم بك 75متر,"650,000",الاسكندرية محرم بك,75,متر²,2,1
4099104,شقة للبيع بالاسكندرية محرم بك 75 متر,"300,000",الاسكندرية محرم بك,75,متر²,2,1
4098502,شقة للبيع بالاسكندرية محرم بك 95 متر,"400,000",الاسكندرية محرم بك,95,متر²,3,1
4096616,شقة للبيع,"480,000",الاسكندريه محرم بك,96,متر²,2,1
4090617,شقه للبيع 75 متر,"650,000",الاسكندرية - محرم بك - شارع الامير مصطفى متفرع من عرفان,75,متر²,2,1
4089500,شقة  للبيع 75م,"300,000",كحرم بك_مركز شباب الحريه,75,متر²,2,1
4101306,شقة للبيع بالاسكندرية محرم بك 90 متر,"750,000",الاسكندرية محرم بك,90,متر²,3,1
4086483,موجود شقة تمليك 70 متر اوضين حمام و صالة مطبخ مفتوح على صالة الدور 8 و الاخير,"200,000",الاسكندريه محرم بك,70,متر²,2,1
4082996,شقه للبيع 115 متر,"1,300,000",الاسكندرية - محرم بك - محور المحمودية - ناصية الرصافة,115,متر²,2,1
4101644,شقه للبيع 85 متر,"400,000",الاسكندرية - محرم بك - شارع النفوس غربال,85,متر²,3,1
4082469,شقة للبيع بالاسكندرية العجمي 90 متر,"550,000",الاسكندرية محرم بك,90,متر²,2,1
4081924,شقه للبيع محرم بك محور المحموديه,"1,400,000",الاسكندرية - محرم بك محور المحموديه  شارع شجره الدر  ابراج السلام,140,متر²,3,1
4081800,شقه بشارع بدر متفرع من شارع محسن باشا محرم بك 64 متر,"250,000",الاسكندرية - محرم بك شارع بدر متفرع من شارع محسن باشا,64,متر²,3,1
4081774,شقه  تمليك في محرم بيه الرصافه ١١٠ متر كاملة العدادات تشطيب سوبر لوكس,"1,700,000",الاسكندرية - محرم بك الرصافة بجوار طأطأ,110,متر²,3,1
4096602,شقه لقطه لدواعى السفر,"1,900,000",الاسكندريه محرم بك,107,متر²,3,1
4095173,شقة للبيع بالاسكندرية محرم بك 85 متر,"530,000",الاسكندرية محرم بك,85,متر²,2,1
4075812,شقه للبيع 160 متر,"1,950,000",الاسكندرية - محرم بك - ثاني نمرة من قناة السويس بين المأمون  - والابعدية,160,متر²,3,2
4064985,شقة للبيع بالاسكندرية محرم بك 100 متر,"450,000",الاسكندرية محرم بك,95,متر²,2,1
4073768,شقة للبيع 85 متر,"590,000",الاسكندرية - محرم بك - شارع بن الحكم خلف المحكمة ومتفرع من ش عرفان,85,متر²,2,1
4073749,شقة للبيع بالاسكندرية محرم بك 85 متر,"590,000",الاسكندرية محرم بك,85,متر²,2,1
4069740,شقه 141 متر علي الترام شارع محرم بك الدور السادس  امام جامع اولاد الشيخ و الكنيس,"2,350,000",محرّم بيك,141,متر²,3,2
4068956,شقة جديدة من المالك مباشرة ،، لم تسكن من قبل شقة ٩٠م محرم بك متفرع من شارع عثمان,"950,000",محرم بك,90,متر²,2,1
4068951,فرصة  شقة موقع متميز في قلب الاسكندرية و أهم ميادينها دقائق من محطة الرمل و المن,"2,000,000",محرم بك,131,متر²,3,2
4069714,شقه للبيع بمحرم بك مساحة 115م  3 غرف ورسيبشن كامله العدادات الدور 12 والاخير سطح,"900,000",محرم بك,115,متر²,3,1
4068973,"شقة رائعة ""بالاسكندرية""في محرم بك  مساحتها٢٢٢ متر فيو قناة السويس ومشروع المحمود","2,350,000",محرم بك,222,متر²,3,3
4068970,شقة للبيع هاي لوكس ٧٠ م من المالك مباشرة غرفتين تصلح لعروسين او لأسرة صغيرة تطل,"900,000",محرم بك,70,متر²,2,1
4095453,شقة للبيع بالاسكندرية محرم بك 120 متر,"750,000",الاسكندرية محرم بك,120,متر²,3,1
4064969,شقة للبيع  محرم بك أول نمره من الترام  مساحة 120 متر دور 15 والبرج 17 دور,"2,000,000",الاسكندريه - محرم بك,120,متر²,3,1
4082461,شقة للبيع بالاسكندرية محرم بك 90متر,"710,000",الاسكندرية محرم بك,90,متر²,2,1
4065305,شقق سوبر لوكس للبيع فى شارع قنال المحمودية البحري,"1,400,000",محرم بك الاسكندريه,140,متر²,3,1
4099644,للبيع 140 متر 3 غرف وريسبشن قطعتين وطرقه توزيع جيده التهويه ومشمسه,"1,250,000",اسكندريه /محرم بك/الرصافه/قنال المحموديه البر القبلى اعلى صيدليه انور,140,متر²,3,1
4099449,شقه لقطه للبيع في محرم بك,"1,650,000",محرم بك-اسكندرية,130,متر²,3,2
4059554,شقة للبيع بالاسكندرية محرم بك 90 متر,"450,000",الاسكندرية محرم بك,90,متر²,2,1
4060134,شقه للبيع محرم بك شارع ابن خقان,"450,000",محرم بك شارع ابن خقان,85,متر²,2,1
4060143,شقه للبيع  مستشفى حميات خطوات لبابور المياه,"550,000",ابور المياه,80,متر²,2,1
4059019,شقه سوبر لوكس حي المهندسين علي محور المحمودية مباشره,"1,250,000","محرّم بيك, الإسكندرية",120,متر²,2,1
4068328,شقة للبيع 70 متر محرم بك,"950,000",محرم بك,70,متر²,2,1
4058088,شقه للبيع  على محور المحموديه بأميز موقع بمحرم بك ناصية الرصافه115متر,"1,300,000",الاسكندرية - على محور المحموديه بأميز موقع بمحرم بك ناصية الرصافه,115,متر²,2,1
4073402,شقة للبيع 85 متر,"700,000",الاسكندرية - محرم بك -  محطه ترام زين العابدين شارع القطاعى عند البان خليفه,85,متر²,3,1
4071522,شقة للبيع 90 متر,"500,000",الاسكندرية - محرم بك - متفرع من شارع راغب باشا,90,متر²,3,1
4108813,شقه للبيع  ١٤٥ متر  3  غرف + ريسيبشن 4 ق  + طرقة توزيع + ( مطبخ و٢ حمام  ),"1,900,000",اسكندريه/( محرم بك ) على الترام مباشرة,145,متر²,3,2
4056995,شقة للبيع بالاسكندرية  محرم بك 108 متر,"1,150,000",الاسكندرية محرم بك,108,متر²,3,1
4054707,شقق فى شارع عبد الحافظ 90 متر² سوبر لوكس للبيع,"420,000",الاسكندريه  شارع النفوس غربال محرم بك بجوار كنيسه الملاك ميخائيل فوق ماجو للتجاره,90,متر²,2,1
4067089,شقة للبيع بالاسكندرية محرم بك 90 متر,"420,000",الاسكندرية محرم بك,90,متر²,3,1
4050915,شقة للبيع بالاسكندرية محرم بك 85 متر,"700,000",الاسكندرية محرم بك,85,متر²,2,1
4082178,شقه للبيع 90 متر,"580,000",الاسكندرية - محرم بك - شارع زين العابدين,90,متر²,4,1
4049770,شقة سوبر لوكس  من المالك مباشرة  المساحة ٨٦ متر غرفتين وريسبشن قطعتين,"950,000",محرم بك,86,متر²,2,1
4073771,توجد شقة للبيع تصلح سكني أو سنتر تعليمي أو عيادة,"300,000",الاسكندرية - محرم بك - شارع أبى أيوب امبروزو خطوات من شارع الحلمية,70,متر²,3,1
4073660,شقه للبيع,"650,000",الاسكندريه بمحرم بيك أمام شارع عرفان فوق صيدلية دكتور معتز حنفي  اول نمرة من ش محسن  تقاطع ش بدر مع ش يعقوب,110,متر²,2,1
4039986,شقة للبيع بالاسكندرية محرم بك160 متر,"1,950,000",الاسكندرية محرم بك,160,متر²,3,2
4035728,شقة للبفي شارع متفرع من شارع عثمان جلال,"750,000",محرم بيك,90,متر²,2,1
4036873,شقة للبيع بزين العابدين محرم بك,"1,750,000",الاسكندرية محرم بك,180,متر²,3,3
4036302,شقه للبيع 135م امام المستشفى الإيطالي العسكري,"2,000,000",محرم بك,135,متر²,3,1
4052832,شقه للبيع 60 متر,"450,000",الاسكندرية - محرم بك - شارع عثمان جلال العمومي,60,متر²,2,1
4038382,من المالك مباشرةً محرم بك - ثاني نمرة من قناة السويس 160 متر,"1,950,000",الاسكندريه محرم بك,160,متر²,3,2
4037417,محرم بك - ثاني نمرة من قناة السوس شقة 160 متر,"1,950,000",الاسكندرية - محرم بك - ثاني نمرة من قناة السوس بيين المأمون والابعدية,160,متر²,3,3
4069556,شقة للبيع بالاسكندرية محرم بك  110 متر,"650,000",الاسكندرية محرم بك,110,متر²,2,1
4068417,شقة للبيع بالاسكندرية محرم بك 110 متر,"720,000",الاسكندرية محرم بك,110,متر²,2,1
4068967,محرم بك الرصافة شقة ارضي لها مطل علي الشارع مساحة ٦٥ متر غرفتين مفتوحين وصالة وم,"425,000",محرم بك,65,متر²,2,1
4003748,شقة للبيع بالاسكندرية محرم بك 220 متر,"2,000,000",الاسكندرية محرم بك,220,متر²,4,3
4000739,شقة مميزة للبيع محرم بك الرئيسى تانى نمرة تشطيب سوبرلوكس -اول سكن,"1,700,000",محرم بك-اسكندرية,120,متر²,3,1
4085060,شقه للبيع 145 متر الاسكندرية - محرم بك,"1,100,000",الاسكندرية - محرم بك - شارع ابن دينار امام سور مستشفى الحميات,145,متر²,3,2
4030185,شقه للبيع,"1,450,000",الاسكندريه محرم بك شارع الاسكندراني,120,متر²,3,1
4011224,شقة تمليك للبيع شارع المفتش محرم بك خطوات للترام وطريق وابور المياه 125 متر,"1,100,000",الاسكندريه محرم بك,125,متر²,3,1
3994782,للبيع شقه محرم بك,"1,800,000",الاسكندرية - محرم بك - زين العابدين,120,متر²,3,1
3981835,شقة تمليك للبيع من المالك 145م محرم بك,"1,500,000",الاسكندرية محرم بك,145,متر²,1,1
3974512,شقة تمليك للبيع من المالك مباشرة مساحة ١٤٥ م٢,"1,500,000",الاسكندرية - محرم بك - شارع أبن دينار . . من شارع الحلمية,145,متر²,3,2
3971658,شقه للبيع في محرم بك  مساحة 138متر,"2,484,000",محرم بك برج مكه المكرمه زين العابدين,138,متر²,3,2
3969500,شقة للبيع 103 م بكمبوند حى محرم باشا,"1,400,000","محرّم بيك, الإسكندرية",103,متر²,2,1
3943445,شقة تمليك للبيع بمحرم بك,"1,050,000",الاسكندريه محرم بك,125,متر²,3,1
3966547,شقة للبيع بالاسكندرية محرم بك 150 متر,"3,200,000",الاسكندرية محرم بك,150,متر²,3,2
3960398,شقة للبيع في شارع ايزيس ٣غرف رسبشن مطبخ كبييي,"850,000",محرم بيك,100,متر²,3,1
3960401,للبيع مش سمسار ١٣٥ متر تشطيب سوبر لوكس,"1,050,000",محرم بيك,135,متر²,3,1
3937666,شقه غرفتين ورسيبشن قطعتين مساحه 115متر,"1,500,000",محرم بك - بمنطقه بولينو ش الكرماني,115,متر²,2,1
3937712,محرم بك - شارع بدر الجمال تطل على مستشفى الايطالى  مساحه الشقه 155م,"1,750,000",محرم بك - شارع بدر الجمال تطل على مستشفى الايطالى,155,متر²,3,1
3956993,شقة للبيع فى وسط البلد موقع متميز ومكان هادى,"820,000",محرم بك,110,متر²,3,1
3942731,محرم بك - شارع بدر الجمال تطل على مستشفى الايطالى  مساحه الشقه 155م الدور السابع,"1,750,000",الاسكندرية محرم بك - شارع بدر الجمال تطل على مستشفى الايطالى,155,متر²,3,1
3918706,شقة للبيع في محرم بك من المالك مباشراً على محور المحمودية، بجوار شارع  الإسكندرا,"1,300,000",محرم بك,120,متر²,3,1
3902841,شقه بكمبوند للبيع 139 متر,"1,500,000",الاسكندريه محرم بك,139,متر²,3,2
4121595,شقة للبيع بالاسكندرية محرم بك 80 متر,"370,000",الاسكندرية محرم بك,80,متر²,2,1
3905699,شقه للبيع 107 متر,"1,350,000",الاسكندريه محرم بك,107,متر²,2,1
3893796,للبيع شقه  مميزة تانى نمره شارع محرم بك الرئيسى -غير مجروحه الدور السادس- اسانسي,"1,700,000",محرم بك,120,متر²,3,1
3892449,شقه للبيع بموقع متميز جدا بمحرم بك,"450,000",شارع ابن محاسن - محرم بك,65,متر²,3,1
3890777,للبيع شقة في محرم بك,"925,000",الاسكندرية,105,متر²,3,1
3882219,شقة  للبيع 65م,"450,000",محرم بك_شارع إبن محاسن,65,متر²,3,1
3871856,شقة لقطة للبيع بمحرم بك,"600,000",الاسكندرية,135,متر²,3,1
3869738,شقه للبيع,"1,400,000",الاسكندرية,120,متر²,3,1
4058677,شقه للبيع 85 متر,"450,000",الاسكندرية - محرم بك - اخر شارع مستشفى النزهه,85,متر²,2,1
3842752,شقه للبيع,"1,800,000",محرم بك,170,متر²,5,2
4039443,شقه للبيع مساحه 115م,"900,000",الاسكندرية - محرم بك - خلف مستشفى ايزيس,115,متر²,3,1
3986174,شقه للبيع ١٢٥ مترمن المالك امام المستشفي الايطالي,"2,000,000",محرم بك علي الترام,125,متر²,3,1
4056912,شقة للبيع بالاسكندرية محرم بك 70متر,"240,000",الاسكندرية محرم بك,70,متر²,2,1
3971183,من المالك بدون وسيط شقه للبيع ١٢٥ متر,"2,000,000",محرم بك علي الترام,125,متر²,3,1
3962857,للتمليك ١٢٥ متر الدور الثاني,"1,000,000",شارع عرفان الرئيسي,125,متر²,3,1
3998479,شقة للبيع في شارع ايزيس,"850,000",الاسكندرية - محرم بك - شارع ايزيس أمام سنتر شاهين,100,متر²,3,1
